,undlName,text
14,WBC.AX,australia stock exchange release from westpac banking wbc.ax: westpac executive changes
12,WBC.AX,"westpac -  david lindberg, chief executive, consumer and craig bright, chief information officer, are leaving westpac"
11,WBC.AX,"westpac announces appointment of les vance as group executive, financial crime, compliance and conduct"
6,WBC.AX,australia's westpac picks an insider to head financial crime and compliance
3,WBC.AX,1-scandal-hit westpac picks insider to head financial crime and compliance
3,ANZ.AX,australia stock exchange release from australia and ne anz.ax: anz - wholesale debt anzhat - interest payment details
8,MQG.AX,australia stock exchange release from macquarie group mqg.ax: mbl: macquarie bank capital notes 2 offer opens
6,MQG.AX,australia stock exchange release from macquarie group mqg.ax: mbl: bcn2 replacement prospectus
11,QAN.AX,qantas announces program to prepare for travel restrictions easing
10,QAN.AX,"qantas - measures include masks on board, hand sanitising stations and enhanced aircraft cleaning"
8,QAN.AX,australia's qantas to provide in-flight masks but will not leave seats vacant
7,QAN.AX,"qantas ceo says if australia's domestic border restrictions lifted could return to 40-50 of domestic capacity in july, ramp up from there"
6,QAN.AX,qantas ceo says will offer 'very low airfares' to stimulate domestic travel demand
4,QAN.AX,1-australia's qantas set to ramp up domestic flights without social distancing
3,QAN.AX,australia's qantas rises on plans to ramp up domestic capacity
2,QAN.AX,"australian students return to school, qantas plans return to skies"
18,IPL.AX,australia stock exchange release from incitec pv ipl.ax: ceasing to be a substantial holder
16,IPL.AX,australia stock exchange release from incitec pv ipl.ax: ipl share purchase plan opens
15,IPL.AX,australia stock exchange release from incitec pv ipl.ax: prenr ends: 08:37:59
13,IPL.AX,incitec pivot- announce its share purchase plan opens today
12,IPL.AX,incitec pivot- will raise up to 75 mln under spp
10,IPL.AX,incitec pivot- issue price of spp shares will be lower of 2.00 per share
7,IPL.AX,australia stock exchange release from incitec pv ipl.ax: change in substantial  from ppt
5,IPL.AX,australia stock exchange release from incitec pv ipl.ax: ceasing to be a substantial holder
1,IPL.AX,australia stock exchange release from incitec pv ipl.ax: ceasing to be a substantial holder
0,RHC.AX,"ramsay health care  rhc.ax : jefferies raises pt to a65.15 from a55.15, rating hold"
6,COH.AX,australia stock exchange release from cochlear coh.ax: denial of appeal rehearing in us patent infringement case
5,COH.AX,"cochlear  - us court of appeals for federal circuit in washington, d.c. denied petition for rehearing of appeal"
2,COH.AX,cochlear - payment expected to be made in current fy; committed bank loan facilities available to fund
3,COH.AX,cochlear - judgment will become final on 26 may and remanded to district court for payment of about us280 mln
4,COH.AX,cochlear  announces denial of appeal rehearing in u.s. patent infringement case
0,COH.AX,cochlear says u.s. court denies petition for rehearing of appeal
