,undlName,text
8,RIO.AX,australia stock exchange release from rio tinto rio.ax: shares of pdmr
4,RIO.AX,australia stock exchange release from rio tinto rio.ax: shares of pdmr
0,IAG.AX,insurance australia group  iag.ax : morgan stanley upgrades to overweight from equal-weight; cuts price target to a7 from a7.9
0,IPL.AX,incitec pivot  ipl.ax : morgan stanley cuts price target to a2.7 from a3.2
0,SUN.AX,suncorp group  sun.ax : morgan stanley cuts price target to a8.2 from a11.8
0,RHC.AX,ramsay health care  rhc.ax : morgan stanley raises price target to a55 from a51
