,undlName,text
8,CBA.AX,australia stock exchange release from commonwealth ban cba.ax: cba instalment warrants - nab dividend
6,CBA.AX,australia stock exchange release from commonwealth ban cba.ax: change in substantial  for web
13,WBC.AX,australia stock exchange release from westpac banking wbc.ax: westpac self-funding instalments over securities in nab
11,WBC.AX,australia stock exchange release from westpac banking wbc.ax: westpac views over securities in nab
18,WBC.AX,australia stock exchange release from select harvests shv.ax: pac partners  westpac agfood conference
3,WBC.AX,australia stock exchange release from buderim group bug.ax: presentation to pac partners  westpac agfood conference
4,MQG.AX,australia stock exchange release from new century reso ncz.ax: change in substantial  from mqg
3,MQG.AX,australia stock exchange release from macquarie group mqg.ax: change in substantial  for ncz
0,WOW.AX,preview: woolworths supermarket sales seen rising amid virus-led stockpiling - analysts
2,QBE.AX,australia stock exchange release from qbe insur. qbe.ax: change of director's interest notice
22,CWN.AX,australia stock exchange release from crown resorts cwn.ax: blackstone advises of purchase of crown shares
21,CWN.AX,australia stock exchange release from crown resorts cwn.ax: prenr ends: 10:10:01
19,CWN.AX,crown resorts  - blackstone advises of purchase of crown shares
15,CWN.AX,crown resorts- informed that purchase of shares from melco resorts  entertainment at 8.15 per share
18,CWN.AX,crown resorts -  entity owned by funds managed or advised by blackstone group purchased 67.7 mln shares in co
17,CWN.AX,crown resorts  -  purchase price of 8.15 per share
14,CWN.AX,australia's crown resorts says blackstone bought near 10 of its shares
13,CWN.AX,crown resorts says blackstone purchase stake in co
10,CWN.AX,australia's crown resorts surges after blackstone buys stake
5,CWN.AX,"2-blackstone takes 360 mln stake in australia's crown, stoking buyout hope"
7,CWN.AX,australia's crown resorts soars amid takeover speculation after blackstone buys stake
3,CWN.AX,"melco international development - unit disposed aggregate of 67.7 mln crown resorts shares, or about 9.99 of issued share capital of crown resorts"
0,CWN.AX,melco international development announces disposal of 9.99 stake in crown resorts by unit melco resorts  entertainment
33,COL.AX,australia stock exchange release from coles group col.ax: 2020 third quarter sales results
13,COL.AX,coles gets quarterly sales boost from coronavirus-led stockpiling
15,COL.AX,"coles group - express now expects to report an ebit loss, on a pre-aasb 16 basis, for 2020 fy"
14,COL.AX,coles -  restrictions placed on number of categories gradually being lifted as demand reduces  supply improves
16,COL.AX,"coles group - liquor expected to continue to experience elevated sales as long as restrictions on hotels,pubs,clubslicensed venue operators continues"
17,COL.AX,coles -  while coles experienced sales uplift in latter part of qtr incremental costs also incurred in cleaning  security
18,COL.AX,"coles - in q4, expects elevated cost base due to additional investment as a result of covid-19"
19,COL.AX,coles - gross operating capex in fy20 now expected to be 750 mln to 850 mln
20,COL.AX,coles -  unprecedented demand led co to begin placing product limits per customer in certain categories from early march
5,COL.AX,2-australia's coles gets quarterly sales boost as shoppers stockpile in pandemic
21,COL.AX,"coles - in first 4 weeks of q4, supermarkets comp sales growth broadly trended back toward levels in early q3"
23,COL.AX,"coles -  in late feb, supermarket sales growth was impacted by customer stock piling due to rising concerns on covid-19"
24,COL.AX,"coles - liquor negatively hit by bushfire smog over capital cities and floods in jan, feb before covid-19 impact"
25,COL.AX,coles - liquor comparable sales growth of 7.2 for q3
27,COL.AX,coles - coles online sales growth for quarter slowed to 14
28,COL.AX,coles group  - q3 supermarkets comparable sales growth  13.1 vs 2.4
29,COL.AX,"coles group  - q3 total sales 9,226 mln vs 8,173 mln"
30,COL.AX,"coles qtrly supermarkets sales 8,230 mln vs 7,232 mln"
32,COL.AX,australia stock exchange release from coles group col.ax: prenr ends: 08:46:50
22,COL.AX,coles -  customer stock piling due to rising concerns on covid-19 continued throughout march
1,COL.AX,australia's coles group falls on q4 cost guidance
15,RHC.AX,australia stock exchange release from ramsay health ca rhc.ax: ramsay share purchase plan offer open
14,RHC.AX,australia stock exchange release from ramsay health ca rhc.ax: prenr ends: 08:44:10
10,RHC.AX,australia stock exchange release from ramsay health ca rhc.ax: ramsay finalises agreement with state of victoria
9,RHC.AX,australia stock exchange release from ramsay health ca rhc.ax: prenr ends: 10:22:26
7,RHC.AX,ramsay health care  - finalised comprehensive agreement with state of victoria
3,RHC.AX,ramsay health care  -  will receive net recoverable costs for its services
4,RHC.AX,"ramsay health care -  discussions with state govts of new south wales, queensland  western australia to finalise agreements continue"
5,RHC.AX,ramsay health care  -  agreement to make its facilities and services available during covid-19 pandemic
6,RHC.AX,ramsay health care -  agreement supersedes heads of agreement under which state ramsay have been operating since 1 april
8,LLC.AX,australia stock exchange release from lendlease group llc.ax: successful completion of institutional placement
7,LLC.AX,australia stock exchange release from lendlease group llc.ax: prenr ends: 10:16:36
5,LLC.AX,"lendlease- placement closed on 28 april  received strong demand, raising 950 mln"
1,LLC.AX,lendlease says received strong demand for placement raising 950 mln
0,LLC.AX,"australia's lendlease gains, completes placement to raise nearly 620 mln"
8,ILU.AX,australia stock exchange release from iluka resources ilu.ax: quarterly review to 31 march 2020
7,ILU.AX,australia stock exchange release from iluka resources ilu.ax: prenr ends: 08:33:11
5,ILU.AX,iluka resources- has no net debt as at 31 march  548 mln of facilities available
3,ILU.AX,"iluka resources  -  q1 zirconrutilesynthetic rutile production of 153 thousand tonnes, down 16 qq"
4,ILU.AX,iluka resources -  altered production settings at narngulu mineral separation plant to reduce zircon production
0,ILU.AX,"australia's iluka resources falls on lower march-qtr production, sales"
