,undlName,text
9,CBA.AX,australia stock exchange release from commonwealth ban cba.ax: cba acknowledges class action proceeding
6,CBA.AX,cba - class action relates to consumer credit insurance for credit cards  personal loans sold between 1 jan 2010 and 7 march 2018
5,CBA.AX,cba -  acknowledges class action proceedings filed by slater and gordon in federal court of australia
4,CBA.AX,cba -  reviewing claim and will provide any as required
3,CBA.AX,cba - reviewing claim brought against colonial mutual life assurance society filed by slater and gordon
7,CBA.AX,cba -  acknowledges class action proceeding
15,CBA.AX,commonwealth bank of australia hit with insurance class action
12,CBA.AX,1-commonwealth bank of australia hit with insurance class action
1,CSL.AX,jefferies cuts pt on csl  as declines in healthcare comparables weigh
34,ANZ.AX,australia stock exchange release from knosys kno.ax: anz bank nz - contract for standalone knowledgeiq system
32,ANZ.AX,australia stock exchange release from australia and ne anz.ax: - dividenddistribution - anzpg
30,ANZ.AX,australia stock exchange release from australia and ne anz.ax: - dividenddistribution - anzph
26,ANZ.AX,australia stock exchange release from australia and ne anz.ax: - dividenddistribution - anzpd
23,ANZ.AX,australia stock exchange release from australia and ne anz.ax: - dividenddistribution - anzpe
20,ANZ.AX,australia stock exchange release from australia and ne anz.ax: - dividenddistribution - anzpf
0,ANZ.AX,australia's knosys hits over 4-month high on anz bank new zealand contract
2,MQG.AX,australia stock exchange release from macquarie group mqg.ax: change of director's interest notices
0,WES.AX,"australia's wesfarmers: jefferies sees higher second-half sales, raises pt"
1,QBE.AX,"australia's accc says the authorisation will apply to suncorp, allianz, qbe insurance and other insurers or insurance brokers who have notified accc"
2,COL.AX,australia stock exchange release from fiji kava fij.ax: fiji kava launches functional noble kava range with coles
0,COL.AX,australia's fiji kava at over 3-month high on product launch with coles
1,SUN.AX,"australia's accc says the authorisation will apply to suncorp, allianz, qbe insurance and other insurers or insurance brokers who have notified accc"
1,LLC.AX,australia stock exchange release from lendlease group llc.ax: change of director's interest notices
